{
  "reportVersion": "1.0.0",
  "generatorName": "smart-home-sim-sensor-deployer",
  "generatorVersion": "1.1.0",
  "success": true,
  "preset": "room_coverage",
  "policyVersion": "1.1.0",
  "policySha256": "96b38fad7b58ebd6784094feb46bde201a125f65f4939a0637aa6dc9065f4fea",
  "sourceBundleId": "mario_rossi_week_2026__synthetic_mario_rome_apartment_logical_v1__1.0.0",
  "sourceBundleSha256": "baf137e7adba5e3969fa2b5cff80aeed119961ed15e780bcf4bde9e93ad00a93",
  "sourceHomeSha256": "dc07fa1f2786cf2a747aeeeb7b6fa761bfc55c8fe17d707567182570193b48b6",
  "sensorModelId": "synthetic_mario_rome_apartment_logical_v1__room_coverage__sensors",
  "sensorModelVersion": "1.1.0",
  "sensorModelSha256": "917fda8c6d4493c593daa6d68bc3b43c4e67205297c5e5e0da8fef922da4cbce",
  "issues": [],
  "summary": {
    "sensorCount": 12,
    "pirCount": 5,
    "contactCount": 2,
    "temperatureCount": 5,
    "errorCount": 0
  }
}
