{
  "reportVersion": "1.0.0",
  "generatorName": "smart-home-sim-sensor-deployer",
  "generatorVersion": "1.1.0",
  "success": true,
  "preset": "room_coverage",
  "policyVersion": "1.1.0",
  "policySha256": "b4195a60879b83a2bfea915c0f29d8d048ae3066f15ac01c8cf75b2f7158d75d",
  "sourceBundleId": "mario_rossi_autonomous_elderly_2026_10_30__synthetic_mario_rome_apartment_logical_v1__behavior_1.1.0__1.0.0",
  "sourceBundleSha256": "bf15142282e5bd616d1e7e112cf08c63b0a91825e9f5a85cac2d33e403e3e10f",
  "sourceHomeSha256": "504c07f6e99465a16c665b7ad6efab140d30c44d38bf46d6c7733378e2ba3717",
  "sensorModelId": "synthetic_mario_rome_apartment_logical_v1__room_coverage__sensors",
  "sensorModelVersion": "1.1.0",
  "sensorModelSha256": "e6b9bad8b46bff268a0f43456c0dd0dda07b807666fcf728a7b27a79434012bd",
  "issues": [],
  "summary": {
    "sensorCount": 17,
    "pirCount": 6,
    "contactCount": 5,
    "temperatureCount": 6,
    "errorCount": 0
  }
}
